{
  "schema_version": 1,
  "task_id": "example-task",
  "workflow_id": "build-feature",
  "mode": "implement",
  "status": "in_progress",
  "current_state": "execute-if-authorized",
  "completed_states": ["intake", "assess"],
  "owner": {
    "agent": "primary",
    "thread": "example-thread",
    "worktree": null
  },
  "workspace": "/absolute/path/to/workspace",
  "lease": null,
  "evidence": [],
  "artifacts": [],
  "approvals": [],
  "blockers": [],
  "next_action": "Continue the authorized implementation.",
  "created_at": "2026-07-13T00:00:00Z",
  "updated_at": "2026-07-13T00:00:00Z",
  "archived": false
}
